{
  "schemaVersion": 2,
  "versionLabel": "1.21.11",
  "mappingKind": "proguard",
  "clientJarNote": "Every class in the batch list is written under geometry/\u003CversionLabel\u003E/: jar SHA-256, javap float probe, and (when bytecode matches the mesh factory pattern) a lifted part/cuboid tree from CubeListBuilder.addBox \u002B texOffs \u002B PartPose. Shards are refreshed from bytecode on each run when lift succeeds; alternate mesh hosts (e.g. Adult*Model, Abstract*\u2192concrete) and delegated factories (invokestatic MeshDefinition/LayerDefinition helpers) are resolved automatically.",
  "entries": [
    {
      "officialJvmName": "net.minecraft.client.model.AdultAndBabyModelPair",
      "shardRelPath": "geometry/1.21.11/net.minecraft.client.model.AdultAndBabyModelPair.json",
      "profile": "proguard_1.21.11",
      "modelIndexJvmName": "net.minecraft.client.model.AdultAndBabyModelPair",
      "extractionStatus": "skipped",
      "classSha256Hex": "30264dcb0851d836c19f0bdbff864de2739a701439180f26adb3383f03c27c4e",
      "jarPath": "gzi.class"
    },
    {
      "officialJvmName": "net.minecraft.client.model.AnimationUtils",
      "shardRelPath": "geometry/1.21.11/net.minecraft.client.model.AnimationUtils.json",
      "profile": "proguard_1.21.11",
      "modelIndexJvmName": "net.minecraft.client.model.AnimationUtils",
      "extractionStatus": "skipped",
      "classSha256Hex": "b26c7933fff55db7d63f61887418490c6ffdbea3aeb5b45d48cb1b56c88c66e6",
      "jarPath": "gzj.class"
    },
    {
      "officialJvmName": "net.minecraft.client.model.ArmedModel",
      "shardRelPath": "geometry/1.21.11/net.minecraft.client.model.ArmedModel.json",
      "profile": "proguard_1.21.11",
      "modelIndexJvmName": "net.minecraft.client.model.ArmedModel",
      "extractionStatus": "skipped",
      "classSha256Hex": "10612f08c78a6cd938f3c8f7d2b0a28e531edc8b6a92df557e10859fa499282e",
      "jarPath": "gzk.class"
    },
    {
      "officialJvmName": "net.minecraft.client.model.BabyModelTransform",
      "shardRelPath": "geometry/1.21.11/net.minecraft.client.model.BabyModelTransform.json",
      "profile": "proguard_1.21.11",
      "modelIndexJvmName": "net.minecraft.client.model.BabyModelTransform",
      "extractionStatus": "skipped",
      "classSha256Hex": "08854c32cdaf71b387e900ecd22dda25c0f7c2fd59dc4df4485521c9831a7b79",
      "jarPath": "gzl.class"
    },
    {
      "officialJvmName": "net.minecraft.client.model.EntityModel",
      "shardRelPath": "geometry/1.21.11/net.minecraft.client.model.EntityModel.json",
      "profile": "proguard_1.21.11",
      "modelIndexJvmName": "net.minecraft.client.model.EntityModel",
      "extractionStatus": "skipped",
      "classSha256Hex": "3f07fa6155e3a847bb1a4ebb6d746f6180faa6b7d555424fd1f8686d46c7ae26",
      "jarPath": "gzm.class"
    },
    {
      "officialJvmName": "net.minecraft.client.model.HeadedModel",
      "shardRelPath": "geometry/1.21.11/net.minecraft.client.model.HeadedModel.json",
      "profile": "proguard_1.21.11",
      "modelIndexJvmName": "net.minecraft.client.model.HeadedModel",
      "extractionStatus": "skipped",
      "classSha256Hex": "aaf76d6f2d1a92cb5adca98e966a4d2f7deb20541860dcbb5aacd0464667aa09",
      "jarPath": "gzn.class"
    },
    {
      "officialJvmName": "net.minecraft.client.model.HumanoidModel",
      "shardRelPath": "geometry/1.21.11/net.minecraft.client.model.HumanoidModel.json",
      "profile": "proguard_1.21.11",
      "modelIndexJvmName": "net.minecraft.client.model.HumanoidModel",
      "extractionStatus": "ok",
      "classSha256Hex": "fc70fc8aab72b3d46840553ac66f1fa9e1079eff319b99b191871e2399b1a332",
      "jarPath": "gzo.class"
    },
    {
      "officialJvmName": "net.minecraft.client.model.HumanoidModel$1",
      "shardRelPath": "geometry/1.21.11/net.minecraft.client.model.HumanoidModel$1.json",
      "profile": "proguard_1.21.11",
      "modelIndexJvmName": "net.minecraft.client.model.HumanoidModel$1",
      "extractionStatus": "skipped",
      "classSha256Hex": "b0c5e10af05f39f19dca9f7579aa0e745f834089f52ecbded9a9468d18b6d79e",
      "jarPath": "gzo$1.class"
    },
    {
      "officialJvmName": "net.minecraft.client.model.HumanoidModel$ArmPose",
      "shardRelPath": "geometry/1.21.11/net.minecraft.client.model.HumanoidModel$ArmPose.json",
      "profile": "proguard_1.21.11",
      "modelIndexJvmName": "net.minecraft.client.model.HumanoidModel$ArmPose",
      "extractionStatus": "skipped",
      "classSha256Hex": "92cca66c7b130a01abc85f82621367c0b9ae258a83602c02ada0bfaabb6cdc8e",
      "jarPath": "gzo$a.class"
    },
    {
      "officialJvmName": "net.minecraft.client.model.HumanoidModel$ArmPose$1",
      "shardRelPath": "geometry/1.21.11/net.minecraft.client.model.HumanoidModel$ArmPose$1.json",
      "profile": "proguard_1.21.11",
      "modelIndexJvmName": "net.minecraft.client.model.HumanoidModel$ArmPose$1",
      "extractionStatus": "skipped",
      "classSha256Hex": "51ed9ca4b0398aceb50fac8db40ce85d4bc41e1a1abcd46fb501bd8ad9233bf9",
      "jarPath": "gzo$a$1.class"
    },
    {
      "officialJvmName": "net.minecraft.client.model.Model",
      "shardRelPath": "geometry/1.21.11/net.minecraft.client.model.Model.json",
      "profile": "proguard_1.21.11",
      "modelIndexJvmName": "net.minecraft.client.model.Model",
      "extractionStatus": "skipped",
      "classSha256Hex": "c8fac28ac54ec1f78d4e5fc3b682916e8c4760ae082d3a4582755067d3af7e15",
      "jarPath": "gzp.class"
    },
    {
      "officialJvmName": "net.minecraft.client.model.Model$Simple",
      "shardRelPath": "geometry/1.21.11/net.minecraft.client.model.Model$Simple.json",
      "profile": "proguard_1.21.11",
      "modelIndexJvmName": "net.minecraft.client.model.Model$Simple",
      "extractionStatus": "skipped",
      "classSha256Hex": "a54efd42d0d576fa9cb28c3da88e9750624fa8ec42f56026fb861a19cf990e5f",
      "jarPath": "gzp$a.class"
    },
    {
      "officialJvmName": "net.minecraft.client.model.QuadrupedModel",
      "shardRelPath": "geometry/1.21.11/net.minecraft.client.model.QuadrupedModel.json",
      "profile": "proguard_1.21.11",
      "modelIndexJvmName": "net.minecraft.client.model.QuadrupedModel",
      "extractionStatus": "ok",
      "classSha256Hex": "b4d202585728d1651a5ba2acf10a98faaa7cdf93cb3d8bbbf6067bae69544352",
      "jarPath": "gzq.class"
    },
    {
      "officialJvmName": "net.minecraft.client.model.VillagerLikeModel",
      "shardRelPath": "geometry/1.21.11/net.minecraft.client.model.VillagerLikeModel.json",
      "profile": "proguard_1.21.11",
      "modelIndexJvmName": "net.minecraft.client.model.VillagerLikeModel",
      "extractionStatus": "skipped",
      "classSha256Hex": "1c5dc1316c9ae9fc49fb11857e3c02f5c085240ab29c52ac88f867e9210e34d0",
      "jarPath": "gzr.class"
    },
    {
      "officialJvmName": "net.minecraft.client.model.ambient.BatModel",
      "shardRelPath": "geometry/1.21.11/net.minecraft.client.model.ambient.BatModel.json",
      "profile": "proguard_1.21.11",
      "modelIndexJvmName": "net.minecraft.client.model.ambient.BatModel",
      "extractionStatus": "ok",
      "classSha256Hex": "4282aea7245a1319cae9cc6a6a1b1e35235e15dae87016a9097a1b46144838ff",
      "jarPath": "gzs.class"
    },
    {
      "officialJvmName": "net.minecraft.client.model.animal.allay.AllayModel",
      "shardRelPath": "geometry/1.21.11/net.minecraft.client.model.animal.allay.AllayModel.json",
      "profile": "proguard_1.21.11",
      "modelIndexJvmName": "net.minecraft.client.model.animal.allay.AllayModel",
      "extractionStatus": "ok",
      "classSha256Hex": "7672c3f86db6b256b28e60c37363fd0be6222a70d0b7477f08b2d965014315a2",
      "jarPath": "gzu.class"
    },
    {
      "officialJvmName": "net.minecraft.client.model.animal.armadillo.ArmadilloModel",
      "shardRelPath": "geometry/1.21.11/net.minecraft.client.model.animal.armadillo.ArmadilloModel.json",
      "profile": "proguard_1.21.11",
      "modelIndexJvmName": "net.minecraft.client.model.animal.armadillo.ArmadilloModel",
      "extractionStatus": "ok",
      "classSha256Hex": "9ace10c9011e9eaf9d8687901e7f6884eaab994b8c197318472d7e45224cb624",
      "jarPath": "gzw.class"
    },
    {
      "officialJvmName": "net.minecraft.client.model.animal.axolotl.AxolotlModel",
      "shardRelPath": "geometry/1.21.11/net.minecraft.client.model.animal.axolotl.AxolotlModel.json",
      "profile": "proguard_1.21.11",
      "modelIndexJvmName": "net.minecraft.client.model.animal.axolotl.AxolotlModel",
      "extractionStatus": "ok",
      "classSha256Hex": "3046d9bb2e14501f29919fdeb1a63587225c8b4c86a87046e91f6da1768e1e63",
      "jarPath": "gzy.class"
    },
    {
      "officialJvmName": "net.minecraft.client.model.animal.bee.BeeModel",
      "shardRelPath": "geometry/1.21.11/net.minecraft.client.model.animal.bee.BeeModel.json",
      "profile": "proguard_1.21.11",
      "modelIndexJvmName": "net.minecraft.client.model.animal.bee.BeeModel",
      "extractionStatus": "ok",
      "classSha256Hex": "a49fe17ba6d4e1e67c113bffb4373d516110501e2589dc937db80b250d866adc",
      "jarPath": "haa.class"
    },
    {
      "officialJvmName": "net.minecraft.client.model.animal.bee.BeeStingerModel",
      "shardRelPath": "geometry/1.21.11/net.minecraft.client.model.animal.bee.BeeStingerModel.json",
      "profile": "proguard_1.21.11",
      "modelIndexJvmName": "net.minecraft.client.model.animal.bee.BeeStingerModel",
      "extractionStatus": "ok",
      "classSha256Hex": "fe7e54c62f7042b998680c4d3209bb3d90071de21316c88f92b386052788ed3a",
      "jarPath": "hab.class"
    },
    {
      "officialJvmName": "net.minecraft.client.model.animal.camel.CamelModel",
      "shardRelPath": "geometry/1.21.11/net.minecraft.client.model.animal.camel.CamelModel.json",
      "profile": "proguard_1.21.11",
      "modelIndexJvmName": "net.minecraft.client.model.animal.camel.CamelModel",
      "extractionStatus": "ok",
      "classSha256Hex": "2e1b015d38bd3299fe388bd569a67ebf6fddd73098e2be78eb7d807115736ea7",